{
  "schemaVersion": 1,
  "status": "unsupported",
  "parser": { "id": "generic-region-scorer", "version": "1", "tier": "generic_html", "sourceAdapter": null },
  "source": {
    "suppliedUrl": null, "normalizedUrl": null, "provider": null, "author": null, "attribution": null,
    "provenance": { "suppliedUrl": [], "normalizedUrl": [], "provider": [], "author": [], "attribution": [] }
  },
  "fields": {
    "title": null, "description": null, "prepTime": null, "cookTime": null, "totalTime": null, "yield": null,
    "ingredientSections": [], "instructionSections": [], "equipment": [], "notes": [], "images": []
  },
  "unclassifiedLines": [
    { "raw": "Chicken", "provenance": [{ "representation": "text/html", "locator": "main nav:nth-of-type(1) > ul:nth-of-type(1) > li:nth-child(1)" }] },
    { "raw": "Turkey", "provenance": [{ "representation": "text/html", "locator": "main nav:nth-of-type(1) > ul:nth-of-type(1) > li:nth-child(2)" }] },
    { "raw": "Beef", "provenance": [{ "representation": "text/html", "locator": "main nav:nth-of-type(1) > ul:nth-of-type(1) > li:nth-child(3)" }] }
  ],
  "competingCandidates": [],
  "warnings": [{
    "code": "NAVIGATION_INGREDIENT_LIST", "severity": "error", "path": "fields.ingredientSections",
    "message": "The ingredient-like list is inside navigation and is not safe to import as recipe content."
  }],
  "discardedContent": [{ "kind": "navigation", "count": 1, "reason": "Navigation lists are not recipe ingredients." }]
}
